{
  "schema_version": "mainframe-env.oracle-harness-receipt@1",
  "receipt_id": "cer1701.synthetic-cics-receipt@1",
  "slot_id": "cics",
  "receipt_state": "plumbing-valid",
  "origin": {
    "kind": "synthetic",
    "authority_id": "cer1701-synthetic-runner",
    "run_job_id": "synthetic-run-1",
    "protected_attestation_digest": null
  },
  "credit": {
    "licensed_differential_credit": 0,
    "accepted_for_final_differential": false,
    "authority": "cer1701-plumbing-only"
  },
  "bindings": {
    "contract": "mainframe-env.oracle-candidate-binding@1",
    "source_commit": "5ab706b1dd069e26db7cb9a2b66e921c9001fc39",
    "source_tree_digest": "sha256:c4e5c4d7d40d6c5618ae4cde2e478d18a531f690f4eebacf44cf16959f70c984",
    "artifacts": [
      {"id": "synthetic-candidate-artifact", "digest": "sha256:6a1c9843c16282e72cc4acfd454948e3c2ca56898510d21e12fb0c52e5e34a04"}
    ],
    "catalogs": [
      {"id": "ibm-cics-ts-6x-2026-08-31", "digest": "sha256:fccd2a8e5cc24dd08aeb32754daf14ed80e9f1b20b5d9e762a1b0cfe429ceeba"}
    ],
    "conformance_spec_digest": "sha256:e599fd3e9a59134207abc7b4075242f3ae6a459ffb3e7faf9a0eddc6adf320d8",
    "fixture_digest": "sha256:5cce953c42c1ddeca1166750f5b7a1bffb2765c4db40f289c64d8af1567b5a5b",
    "oracle_adapter_digest": "sha256:7bde0441642fff59ab28af46e815c7c1ba4f65e47ca1066aad7536a910b9873d",
    "normalization_policy_digest": "sha256:111f3304ea7c6c9f3a7d380756ebb7cc5180283b59fa4e38dc8f12d358cd2ce9",
    "environment_manifest_digest": "sha256:db66d9d7159d10d0198da1be6a9080a26e086127620fc1e8fddb8d8f317f24b9",
    "harness_registry_digest": "sha256:6ea775f829625fd47aee51b5b20e494fd30847b213b26fb4b738c82a4666098d"
  },
  "compatibility": {
    "legacy_schema_version": "mainframe-env.cics-oracle-capture@1",
    "legacy_receipt_digest": "sha256:1b6ceda4faa34233a7fa0f3f45558b3826c32127cb223c234dca765b1c90cc82",
    "read_rule": "exact-v1-plus-cer1701-envelope",
    "subsystem_validator_status": "synthetic-fixture-pass"
  },
  "execution": {
    "status": "pass",
    "expected_cases": 12,
    "observed_cases": 12,
    "raw_capture_digest": "sha256:1b6ceda4faa34233a7fa0f3f45558b3826c32127cb223c234dca765b1c90cc82",
    "normalized_capture_digest": "sha256:03305af9e0f7b2c36604c553fc0136fceace72d8ed657c3dcbe4f4064b818a9b",
    "started_at": "2026-09-22T00:00:00Z",
    "finished_at": "2026-09-22T00:00:01Z"
  },
  "normalization": {
    "policy_id": "cics.file-uow-exact@1",
    "rules_applied": [],
    "all_other_fields_exact": true
  },
  "redaction": {
    "policy_id": "cer1701.synthetic-redaction@1",
    "scan_status": "pass",
    "contains_secrets_or_customer_data": false,
    "raw_outputs_retained_outside_git": true
  },
  "review": {
    "fixture_independence": "synthetic-only",
    "environment": "synthetic-only",
    "normalizer": "synthetic-only",
    "receipt": "synthetic-only"
  },
  "replay": {
    "program": "cargo",
    "arguments": ["xtask", "cics-oracle", "--capture", "EXTERNAL_CAPTURE", "--public-key", "EXTERNAL_PUBLIC_KEY"],
    "required_environment_variables": ["MAINFRAME_ENV_CICS_ORACLE_PUBLIC_KEY"],
    "working_tree_commit": "5ab706b1dd069e26db7cb9a2b66e921c9001fc39"
  }
}
